{"allow_client_weights":false,"allow_experimental":false,"allow_he":false,"allow_online_preparation":false,"id":"privacy.single-evaluator","online_parties":1,"required_claims":[{"accepted_implementation_refinements":["tested_differential","proved_for_locked_code"],"accepted_outcomes":["proved_in_model"],"claim_id":"composition-privacy"}],"schema_version":"pllm.privacy_contract.v1"}
